,VideoID,Start,End,WorkerID,Source,AnnotationTime,Language,Description
12539,Zqmx-nXhLAg,0,10,682611,clean,104,English,"A young man is holding and petting a small animal, while another another man watches."
5609,ZsrPKtx0qyg,7,15,550906,clean,27,English,A puppy wagging his tail on the steps.
31052,ZvJvNcukZ4w,0,10,435773,clean,20,English,A badger and a fox are fighting.
4993,ZxqkAGNyo8A,12,22,550906,clean,18,English,a baby playing with a toy piano
7048,_0nX-El-ySo,83,93,682611,clean,69,English,A man is cutting a piece of paper in half lengthwise using scissors.
10313,_1vy2HIN60A,32,40,550906,clean,95,English,A wallaby bagged in a office.
4386,_6OTzzK7t9Y,158,170,550906,clean,28,English,A man is playing the piano.
3883,_7nP9z6T9m8,11,17,617730,clean,52,English,A bicyclist hits his face on a road sign.
20971,_9iG5Ge01PM,3,11,550906,clean,37,English,A kitten moves about.
9965,_JVxurtGIhI,32,42,550906,clean,25,English,A woman sings on stage.
37981,_JorUS-8Nlg,63,73,682611,clean,110,English,A bus is being driven down a street with a group of people sitting on it's roof and hanging off the back.
7939,_KMoC6ZdeXs,10,16,682611,clean,37,English,A young man is seated and playing a guitar.
3058,_O9kWD8nuRU,25,35,682611,clean,241,English,A woman is cutting a yellow vegetable-looking substance into pieces.
46496,_OBlgSz8sSM,15,32,550906,clean,68,English,Two young boys are playing together.
5489,_QJbjKkfdcs,52,57,135621,clean,52,English,A man is playing a violin and then a woman starts to sing.
5092,_SNE2MYAotU,41,49,682611,clean,66,English,Someone is petting some kind of animal.
10988,_UqnTFs1BLc,23,27,760882,clean,38,English,A girl is drinking from a cup.
3535,_WRC7HXBJpU,414,425,651813,clean,35,English,A man is adding water to a pan.
31409,_ZwwKOzpt2I,69,76,922727,clean,34,English,Meat is being sliced.
3958,_o1UXSxTjfo,68,80,159786,clean,265,English,A man bags produce and talks to a group.
37200,_pBeOAMjGm8,1,18,280252,clean,34,English,A man is playing a guitar.
18524,_pj2Nutu5v8,1,8,159786,clean,554,English,An infant speaks into a microphone.
45076,_sJ_09Mf1HY,49,72,550906,clean,46,English,A boy is dribbling a soccer ball at a show.
1191,_txL575S_OA,13,23,772960,clean,295,English,A dazzle of zebras are grazing on grassland.
15947,_xf24TYgbuY,14,20,550906,clean,72,English,Paper towels are being placed under some bacon.
6028,_yUiusXxfWI,150,165,550906,clean,48,English,Jute wine is being cooked in a wok.
30128,a-cek0mvXxE,15,25,922727,clean,24,English,A man is polishing a floor.
46100,a0g7wtBkS98,34,42,760882,clean,31,English,A girl dives into a lake.
1052,a1Y73sPHKxw,0,5,252681,clean,31,English,"While standing on its hind legs, a prairie dog turns to look at the camera."
13518,a1i6T160REQ,5,18,550906,clean,29,English,A man feeding a baby kangaroo.
38558,a28s_wyqkyc,68,77,760882,clean,21,English,A man is running.
22834,a8PAY4rvzRM,1,10,550906,clean,37,English,A rooster playing with a dead animal
32653,aA05I5QaZnM,66,75,878566,clean,37,English,A young woman is curling her hair with a round hairbrush.
12262,aC-KOYQsIvU,25,31,682611,clean,76,English,Someone is stirring something in a saucepan with what appears to be a stick.
30570,aCKNdip53W4,0,25,760882,clean,32,English,A sleepy baby is sitting on the floor.
36914,aDjNl5gs4nM,18,47,550906,clean,23,English,A person cutting a up a onion
35353,aGUx0QOKWXw,7,12,682611,clean,232,English,"An episode of ""I Love Lucy"" where Desi lights Lucy a cigarette."
3476,aHiUM8uWxxo,17,25,550906,clean,33,English,two boys flying a toy airplane
38860,aJoDt4DMkFU,118,124,682611,clean,71,English,Someone is sewing quilt squares on a sewing machine.
19486,aK8liAv-28s,72,82,550906,clean,39,English,A dragon moving in a room
25703,aM-RcQj0a7I,37,55,550906,clean,63,English,Chicken is being stirred in boiled.
16573,aN0WsBcja_E,0,15,878566,clean,25,English,A Siamese kitten is playing with a cat toy.
24681,aQWCKcg0VRU,321,339,550906,clean,87,English,A man is stirring chocolate in a huge bucket.
2842,aRo8x3xXeEA,3,8,411294,clean,17,English,The snowboarder is doing tricks.
489,aeA-HN7BMdo,34,41,550906,clean,48,English,a women cutting broccoli up
44176,akXjIEoecNs,2,12,550906,clean,29,English,A man is playing the key board.
6785,ao-9B8IV9_E,175,187,550906,clean,51,English,A dog walks over a kid who is inside his house.
23845,auFXfsCzAvQ,1,15,550906,clean,42,English,A dog tries to drink from a pool.
22579,b-d-CxHaKGU,10,30,550906,clean,44,English,A teacher explaining a math problem.
39893,b24_bb57PPk,631,637,550906,clean,44,English,Marlon Wayons serving food at an event.
35028,b4FM9OLBGyM,37,49,550906,clean,102,English,A young woman puts eyeliner on .
36736,b4mJ3AQc-ag,30,34,550906,clean,39,English,A piece of chicken is being torn apart.
24798,b71bI0rH1g8,75,90,550906,clean,36,English,A man is loading his gun.
31768,b97TK8XVLHE,40,50,682611,clean,136,English,A man is smiling as he reads an email message.
37768,bAYIIlX-WWw,5,15,682611,clean,107,English,A man is sitting cross legged playing a wooden flute.
41594,bDoCQEwghZU,201,211,651813,clean,22,English,A man is spinning in a chair.
887,bJJndejsUWc,88,98,682611,clean,100,English,A band is performing on stage with fire in the background.
39258,bK-i_FAcpoY,86,92,682611,clean,125,English,"A man in a suit and sunglasses is sitting and smoking a thin cigar, and the smoke is swirling behind his head."
12340,bL_Kijz9IN4,0,15,649657,unverified,111,English,a girl is slicing garlic
16039,bLqmf8x7rLI,2,8,682611,clean,80,English,A panda looking dog is walking down a sidewalk.
1421,bQJQGoJF7_k,109,115,760882,clean,47,English,A man is pouring seasoning in a plastic container.
